doi,title,year,cluster,topic_label
10.3390/ma15238439,Sulfonated-Recycled-PEEK as Matrix of Water Vapor Adsorbent SAPO-34 Based Composite Coatings for Adsorption Heat Pumps: Mechanical and Thermochemical Characterization,2022,3,"mechanical properties, tensile strength, polypropylene pp, injection molding"
10.1007/s42452-023-05344-5,Building a community-scale plastic recycling station to make flower pots from bottle caps,2023,5,"sustainable development, environmental awareness, climate change, purchase intention"
10.1021/acs.jchemed.3c00692,A Polymer Degradation and Remanufacturing Experiment in the High School Classroom,2023,5,"sustainable development, environmental awareness, climate change, purchase intention"
10.3390/recycling8060094,Exploring the Plastic Collection and Recycling Trends in Sri Lanka,2023,5,"sustainable development, environmental awareness, climate change, purchase intention"
10.1002/pam.22554,Habit and skill retention in recycling,2023,5,"sustainable development, environmental awareness, climate change, purchase intention"
10.3390/electronics12102201,SURE: A Smart Failover Blockchain-Based Solution for the Recycling Reuse Process,2023,5,"sustainable development, environmental awareness, climate change, purchase intention"
10.4103/0028-3886.378675,Acute Toxic Encephalopathy in Occupational Exposure with Polyvinyl Chloride (PVC) Fumes,2023,2,"polyethylene terephthalate pet, supporting information, molecular weight, pyrolysis oil"
10.3390/pr11020515,Polyethylenes and Polystyrenes with Carbazole Fluorescent Tags,2023,2,"polyethylene terephthalate pet, supporting information, molecular weight, pyrolysis oil"
10.3390/iocbd2023-15177,Potential Applications of Different Forms of Recycled Plastics as Construction Materials—A Review,2023,3,"mechanical properties, tensile strength, polypropylene pp, injection molding"
10.1002/gch2.202300157,The Effects of Bromine Additives on the Recyclability of Injection Molded Electronic Waste Polymers,2023,6,"supply chain, climate change, environmental impacts, value chain"
10.1255/jsi.2023.a2,Estimation of pigment concentration in LDPE via in-line hyperspectral imaging and machine learning,2023,3,"mechanical properties, tensile strength, polypropylene pp, injection molding"
10.1155/2023/2378231,Investigation of Gas Release from Recycled Plastic Shopping Bags during Melting at Low Temperatures,2023,2,"polyethylene terephthalate pet, supporting information, molecular weight, pyrolysis oil"
10.3390/recycling8030051,Effect of Virgin PP Substitution with Recycled Plastic Caps in the Manufacture of a Product for the Telephony Sector,2023,7,"marine debris, metric tons, human health, u s"
10.3390/app132112081,Clayey Soil Improvement with Polyethylene Terephthalate (PET) Waste,2023,4,"compressive strength, mechanical properties, flexural strength, tensile strength"
10.4028/p-5m4uqt,Using PETG/rPET Blends in Fused Particle Fabrication: Analysis of Feasibility and Mechanical Behaviour,2023,3,"mechanical properties, tensile strength, polypropylene pp, injection molding"
10.3390/su15032641,Modify the Injection Machine Mechanism to Enhance the Recycling of Plastic Waste Mixed with MHD Nanoparticles,2023,3,"mechanical properties, tensile strength, polypropylene pp, injection molding"
10.2139/ssrn.4458151,A Cyber-Physical Approach to Enhance Circular Economy through Additive Manufacturing in Learning Factories,2023,6,"supply chain, climate change, environmental impacts, value chain"
10.3390/recycling8020037,A Study on the Calculation of the Standard Recycling Cost of PVC Profiles and Flooring Waste in Korea,2023,6,"supply chain, climate change, environmental impacts, value chain"
10.3390/polym15132943,Separation and Characterization of Plastic Waste Packaging Contaminated with Food Residues,2023,3,"mechanical properties, tensile strength, polypropylene pp, injection molding"
10.3126/ijosh.v13i1.44575,Identification of Musculoskeletal Disorder among Eco-Brick Workers in Indonesia,2023,5,"sustainable development, environmental awareness, climate change, purchase intention"
10.1088/1755-1315/1151/1/012010,Plastic waste knowledge of households towards a sustainable environment,2023,5,"sustainable development, environmental awareness, climate change, purchase intention"
10.33150/jitdets-7.1.1,Reuse of Non-Degradable Waste Polyethylene Bottles for Ground Improvement,2023,4,"compressive strength, mechanical properties, flexural strength, tensile strength"
10.1002/vnl.22074,Effects of corn husk fiber as filler in recycled single‐use polypropylene for fused filament fabrication,2023,3,"mechanical properties, tensile strength, polypropylene pp, injection molding"
10.3390/app132312825,Amplification Ratio of a Recycled Plastics-Compliant Mechanism Flexure Hinge,2023,3,"mechanical properties, tensile strength, polypropylene pp, injection molding"
10.1088/1755-1315/1196/1/012069,Investigation on the use of PET and XLPE plastic wastes as aggregates in cement-based mortars,2023,4,"compressive strength, mechanical properties, flexural strength, tensile strength"
10.3390/ma16175891,Material Characterization of Polypropylene and Polystyrene Regarding Molecular Degradation Behavior,2023,3,"mechanical properties, tensile strength, polypropylene pp, injection molding"
10.1177/03611981231187387,Impact of Modified Post-Consumer Plastic (MPCP) Toner on Asphalt Binder Properties,2023,4,"compressive strength, mechanical properties, flexural strength, tensile strength"
10.1051/e3sconf/202344803056,Rural Waste Reduction Potential in The South of Gunungkidul Regency,2023,6,"supply chain, climate change, environmental impacts, value chain"
10.2533/chimia.2023.842,Valorisation of Plastic Waste via Catalytic Hydrocracking: a Technological Survey,2023,7,"marine debris, metric tons, human health, u s"
10.1088/1755-1315/1257/1/012014,The Influence of Pandemic COVID-19 on Hazardous Waste Management from Hospital A in Yogyakarta,2023,6,"supply chain, climate change, environmental impacts, value chain"
10.1515/auto-2024-0067,Biocatalytic approaches for plastic recycling,2024,2,"polyethylene terephthalate pet, supporting information, molecular weight, pyrolysis oil"
10.24857/rgsa.v18n10-275,A Business Management Model in the Circular Economy: Technological Solutions for Plastic Recycling,2024,6,"supply chain, climate change, environmental impacts, value chain"
10.1016/j.cec.2024.100075,PHOENIX: Towards a circular economy of plasmix waste—A systemic design approach,2024,6,"supply chain, climate change, environmental impacts, value chain"
10.1002/advs.202410773,Closed‐Loop Recyclable and Extrusion Reprocessable Thermosets Enabled by Guanylthiourea Structure,2024,2,"polyethylene terephthalate pet, supporting information, molecular weight, pyrolysis oil"
10.1016/j.rcradv.2024.200211,Archetypes to categorise upstream packaging strategies for a circular economy,2024,7,"marine debris, metric tons, human health, u s"
10.1002/ece2.81,Plastic‐to‐Treasure: Innovative advances in photo/electro‐catalytic upcycling technologies for commodity chemicals and fuels,2024,2,"polyethylene terephthalate pet, supporting information, molecular weight, pyrolysis oil"
10.3390/polym16162238,Investigation of the Impact of Single and Double Filtration Systems on Post-Consumer PE Film Waste,2024,7,"marine debris, metric tons, human health, u s"
10.3390/polym16223103,Repurposing ABS to Produce Polyamide 6 (PA6)-Based Blends: Reactive Compatibilization with SAN-g-MA of a High Degree of Functionalization,2024,3,"mechanical properties, tensile strength, polypropylene pp, injection molding"
10.3390/constrmater4030032,"Possibility of Making Plastic Roof Tiles from Waste Plastic, Sand, and Fly Ash",2024,4,"compressive strength, mechanical properties, flexural strength, tensile strength"
10.3390/su16052106,Mechanical Properties of Polymers Recovered from Multilayer Food Packaging by Nitric Acid,2024,3,"mechanical properties, tensile strength, polypropylene pp, injection molding"
10.3390/polym16233441,Compatibilizer Efficiency in Enhancing Marine Plastic Waste Valorization Through Simulated Recycled Plastic Blends,2024,3,"mechanical properties, tensile strength, polypropylene pp, injection molding"
10.1142/s0217979225501279,A sustainable route for producing reduced graphene oxide nanosheets from recycled plastic waste for high-performance supercapacitor applications,2024,2,"polyethylene terephthalate pet, supporting information, molecular weight, pyrolysis oil"
10.1177/03611981241302338,Life Cycle Assessment of Recycled Plastic Modified Asphalt Pavements: A Case Study in Virginia,2024,4,"compressive strength, mechanical properties, flexural strength, tensile strength"
10.1007/s42947-024-00482-4,Performance Evaluation of Post-Consumer and Post-Industrial Recycled Plastics as Binder Modifier in Asphalt Mixes,2024,4,"compressive strength, mechanical properties, flexural strength, tensile strength"
10.1139/cjce-2024-0438,"Sustainable application of recycled plastics in asphalt pavement: Case study of a trial in Newtonville, Ontario, Canada",2024,4,"compressive strength, mechanical properties, flexural strength, tensile strength"
10.3390/info15120784,"Implementation of the Asset Management, Operational Reliability and Maintenance Survey in Recycled Beverage Container Manufacturing Lines",2024,6,"supply chain, climate change, environmental impacts, value chain"
10.37121/jase.v1i2.27,Design and Fabrication of a Plastic Film Granulating Machine,2018,3,"mechanical properties, tensile strength, polypropylene pp, injection molding"
10.31142/ijtsrd11532,Experimental and numerical investigation on structural behaviour of Bubble Deck Slab with conventional slab,2018,4,"compressive strength, mechanical properties, flexural strength, tensile strength"
10.52842/conf.ecaade.2018.2.053,PET(s)culpt - Crowd-printing recycled polyethylene tereftalate,2018,3,"mechanical properties, tensile strength, polypropylene pp, injection molding"
10.1142/s2251237318500028,Mechanical Properties and Thermal Conductivity of Coal Ash-Recycled High-Density Polyethylene Composite,2018,4,"compressive strength, mechanical properties, flexural strength, tensile strength"
10.2903/j.efsa.2018.5481,"Safety assessment of the process ‘RecyPET Hungária’, based on RecyPET Hungária technology, used to recycle post‐consumer PET into food contact materials",2018,3,"mechanical properties, tensile strength, polypropylene pp, injection molding"
10.1515/cse-2018-0002,Catalytic quality improvement of waste polyolefin originated fractions,2018,2,"polyethylene terephthalate pet, supporting information, molecular weight, pyrolysis oil"
10.1051/e3sconf/20199302007,A Conceptual Design and Numerical Analysis for a Small-Scale and Low-Cost Plastic Recycling Machine,2019,6,"supply chain, climate change, environmental impacts, value chain"
10.1088/1757-899x/708/1/012095,Using solid household plastic waste in the construction of soil embankments,2019,4,"compressive strength, mechanical properties, flexural strength, tensile strength"
10.1021/cen-09702-cover5,Tide will turn against single-use plastic,2019,7,"marine debris, metric tons, human health, u s"
10.15407/econlaw.2019.02.084,CIRCULAR PUBLIC PROCUREMENT AS A TOOL IN ACHIEVING THE SUSTAINABLE DEVELOPMENT GOALS,2019,6,"supply chain, climate change, environmental impacts, value chain"
10.13073/fpj-d-13-00038,Manufacturing Wood–Plastic Composites from Waste Lignocellulose Plus Haloxylon Species and Recycled Plastics,2019,3,"mechanical properties, tensile strength, polypropylene pp, injection molding"
10.1680/jenes.19.00020,"Energy Recovery from the Aged Waste in Saravan Dump Site, Rasht, Iran",2019,6,"supply chain, climate change, environmental impacts, value chain"
10.35784/acs-2019-06,DEVELOPMENT OF SOFTWARE FOR IDENTIFICATION OF FILAMENTS USED IN 3D PRINTING TECHNOLOGY,2019,6,"supply chain, climate change, environmental impacts, value chain"
10.18421/tem83-19,Application of Multi-criteria Decision-making Methods for the Area of Recycling,2019,6,"supply chain, climate change, environmental impacts, value chain"
10.1109/icaee47123.2019.9014775,Realization and Optimization of a New Inclined Plane Electro-Separator,2019,3,"mechanical properties, tensile strength, polypropylene pp, injection molding"
10.1063/1.5141260,Design and development of pallet extruder,2019,3,"mechanical properties, tensile strength, polypropylene pp, injection molding"
10.1063/5.0007039,Development of water filtration unit for wastewater generated from waste plastics recycling machines,2020,7,"marine debris, metric tons, human health, u s"
10.1088/1757-899x/1003/1/012127,Durability of Repetitive Polypropylene Recycling: Challenge on Securing The Mechanical Properties,2020,3,"mechanical properties, tensile strength, polypropylene pp, injection molding"
10.1117/12.2555876,Plastic sorting based on MEMS FTIR spectral chemometrics sensing,2020,6,"supply chain, climate change, environmental impacts, value chain"
10.4028/www.scientific.net/msf.1015.70,Effect of Repetitive Recycling on the Mechanical Properties of Polypropylene Blends Based on Material Value Conservation Paradigm,2020,3,"mechanical properties, tensile strength, polypropylene pp, injection molding"
10.1088/1755-1315/498/1/012064,A Domestic Plastic Waste Recycling Procedure to Find the Optimal Heat Treatment for Better Hardness and Compression Properties,2020,3,"mechanical properties, tensile strength, polypropylene pp, injection molding"
10.1088/1742-6596/1625/1/012017,Study of Utilizations of Recycled LDPE Plastic and Stone Ash Waste from Remaining Split Stone Fragments for Block Paving Application,2020,4,"compressive strength, mechanical properties, flexural strength, tensile strength"
10.23919/iccas50221.2020.9268282,Development of real-time automatic sorting system for color PET recycling process,2020,7,"marine debris, metric tons, human health, u s"
10.1088/1742-6596/1539/1/012068,Application of Pyrolysis Technology as an Effort to Reduce Plastic Waste,2020,6,"supply chain, climate change, environmental impacts, value chain"
10.4028/www.scientific.net/msf.981.144,Effect of Graphite on Mechanical Thermal and Morphological Properties of Kenaf Recycle Polypropylene Wood Plastic Composites,2020,3,"mechanical properties, tensile strength, polypropylene pp, injection molding"
10.1109/iiceta50496.2020.9318843,Flexural Behavior and Sustainability Analysis of Hollow-core R.C. One-way Slabs,2020,4,"compressive strength, mechanical properties, flexural strength, tensile strength"
10.14416/j.asep.2020.11.003,Using of Plastic Wastes as Additives in Bituminous Mixes,2020,4,"compressive strength, mechanical properties, flexural strength, tensile strength"
10.26565/1992-4259-2020-23-06,Plastic of the Solid Domestic Waste on the Coastal Zone of the Northwestern Part of the Black Sea as a Component of Marine Littre,2020,6,"supply chain, climate change, environmental impacts, value chain"
10.21608/bfemu.2020.124903,Investigating The Use of Recycled Plastics as Shrinkage Reinforcement in Non-Structural Concrete Slabs (Dept.C),2020,4,"compressive strength, mechanical properties, flexural strength, tensile strength"
10.30564/jbms.v1i1.1204,Feasibility Study on Use of Plastic Waste as Fine Aggregate in Concrete Mixes,2020,4,"compressive strength, mechanical properties, flexural strength, tensile strength"
10.52763/pjsir.phys.sci.63.2.2020.79.88,Studies of Liquid Fuel Formation from Plastic Waste by Catalytic Cracking Over Modified Natural Clay and Nickel Nanoparticles,2020,2,"polyethylene terephthalate pet, supporting information, molecular weight, pyrolysis oil"
10.2139/ssrn.3871885,Innovative Business Models in Ocean-Bound Plastic Recycling,2021,6,"supply chain, climate change, environmental impacts, value chain"
10.15611/pn.2021.1.01,Plastic recycling in Poland – a transformation towards a circular economy?,2021,6,"supply chain, climate change, environmental impacts, value chain"
10.46842/ipn.cien.v25n1a04,Reintroducing Industrial Engineering Students to Manufacturing through Environmental Pertinence,2021,5,"sustainable development, environmental awareness, climate change, purchase intention"
10.37756/bk.21.3.5.1,Recent Trends in Omics-Based Enzyme Discovery to Combat Global Plastic Waste Crisis,2021,2,"polyethylene terephthalate pet, supporting information, molecular weight, pyrolysis oil"
10.1088/1742-6596/1885/3/032030,Application of Co Ni intercalated vermiculite catalyst in pyrolysis of plastics,2021,2,"polyethylene terephthalate pet, supporting information, molecular weight, pyrolysis oil"
10.24821/productum.v4i1.3981,Eksplorasi material daur ulang kantong plastik dengan teknik origami,2021,3,"mechanical properties, tensile strength, polypropylene pp, injection molding"
10.22161/ijeab.65.1,Status of Solid Wastes and its Management in the Coastal Environments of Sri Lanka,2021,5,"sustainable development, environmental awareness, climate change, purchase intention"
10.15328/cb1117,Recycling of waste plastics to liquid fuel mixture over composite zeolites catalysts,2021,2,"polyethylene terephthalate pet, supporting information, molecular weight, pyrolysis oil"
10.3390/infrastructures6030047,Numerical Investigation of Slope Stabilization Using Recycled Plastic Pins in Yazoo Clay,2021,4,"compressive strength, mechanical properties, flexural strength, tensile strength"
10.1061/9780784483428.022,Effect of Rainfall Intensity and Duration on the Highway Slopes Reinforced with Recycled Plastic Pin,2021,4,"compressive strength, mechanical properties, flexural strength, tensile strength"
10.1088/1755-1315/621/1/012050,Identification Method of Solid Waste Characteristic for Imported Recycled Engineering Plastics,2021,3,"mechanical properties, tensile strength, polypropylene pp, injection molding"
10.37881/1.620,Bioplastics advances and their role in the management of plastic pollution,2021,7,"marine debris, metric tons, human health, u s"
10.1080/09593330.2021.1983026,Example of removing printing ink from plastic surface using quaternary ammonium-modified waste cooking oil,2021,2,"polyethylene terephthalate pet, supporting information, molecular weight, pyrolysis oil"
10.4028/www.scientific.net/msf.1020.192,Impact of Repetitive Recycling on Optical Properties of Virgin and Recycled Polypropylene Blends Based on Material Value Conservation Paradigm,2021,3,"mechanical properties, tensile strength, polypropylene pp, injection molding"
10.1088/1757-899x/1090/1/012133,Flexural Behaviour of Hollow Reinforced Concrete T-Beams,2021,4,"compressive strength, mechanical properties, flexural strength, tensile strength"
10.3390/jcs5080205,A Study on the Effect of Construction and Demolition Waste (CDW) Plastic Fractions on the Moisture and Resistance to Indentation of Wood-Polymer Composites (WPC),2021,3,"mechanical properties, tensile strength, polypropylene pp, injection molding"
10.1016/j.ceja.2021.100085,Superabsorbent recycling for process water recovery,2021,2,"polyethylene terephthalate pet, supporting information, molecular weight, pyrolysis oil"
10.1109/uv56588.2022.10185468,"Evaluation of Plastic Recycling and Novel UV-Oriented Solution for Integration, Resilience, Inclusiveness, and Sustainability",2022,7,"marine debris, metric tons, human health, u s"
10.1051/e3sconf/202234905001,The impact of secondary materials’ quality on assessing plastic recycling technologies,2022,7,"marine debris, metric tons, human health, u s"
10.1109/ism55400.2022.00040,Using Web 3D and WebXR Game to Enhance Engagement in Primary School Learning,2022,5,"sustainable development, environmental awareness, climate change, purchase intention"
10.3390/polym14091681,The 3D-Printing-Accelerated Design for a Biodegradable Respirator from Tree Leaves (TRespirator),2022,7,"marine debris, metric tons, human health, u s"
10.31940/logic.v18i2.972,DESIGNING PLASTIC CUPES RING CUTTING MACHINE TO INCREASE PRODUCTIVITY,2018,6,"supply chain, climate change, environmental impacts, value chain"
10.14207/ejsd.2018.v7n4p489,Eco Sustainable Rail - Valorization of Mixed Plastics in the Development of Eco-Sustainable Railways,2018,6,"supply chain, climate change, environmental impacts, value chain"
10.1088/1757-899x/334/1/012014,The influence of temperature on the formation of liquid fuel from Polypropylene plastic wastes,2018,7,"marine debris, metric tons, human health, u s"
10.21452/bccm4.2018.14.01,THERMAL PROPERTIES STUDY OF RECYCLED ESPRESSO COFFEE CAPSULES FOR BIOCOMPOSITE APPLICATION,2018,3,"mechanical properties, tensile strength, polypropylene pp, injection molding"
10.1115/imece2018-86498,Anti-Corrosive Coating Using Recycled High Density Polyethylene for Automotive Chassis,2018,3,"mechanical properties, tensile strength, polypropylene pp, injection molding"
10.30723/ijp.v16i36.37,Using the plastic wastes in fabrication of composite materials for different applications,2018,3,"mechanical properties, tensile strength, polypropylene pp, injection molding"
10.24018/ejers.2018.3.5.707,Comparing the Effect of Fillers on the Mechanical Properties of Recycled Low Density Polyethylene Composites Under Non-Weathered and Weathered Conditions,2018,3,"mechanical properties, tensile strength, polypropylene pp, injection molding"
10.1088/1757-899x/549/1/012032,The issue of plastic waste in the environment and its possible uses as a substitute for filler in lightweight concrete,2019,3,"mechanical properties, tensile strength, polypropylene pp, injection molding"
10.1109/icecco48375.2019.9043197,Design and Implementation of a Plastic Waste Sorting System,2019,6,"supply chain, climate change, environmental impacts, value chain"
10.24247/ijmperdjun201999,Developing the Plastic Green Supply Chain Management Framework and Implementation Strategy to Deliver the Sustainability Needs of Plastic Processing Industries,2019,6,"supply chain, climate change, environmental impacts, value chain"
10.11648/j.ajad.20180304.11,Design and Production of Decorative Flower Pot from Plastic Wastes,2019,5,"sustainable development, environmental awareness, climate change, purchase intention"
10.30657/pea.2019.25.07,Comparison of the properties of the original and applied LDPE foils in returned bottles,2019,7,"marine debris, metric tons, human health, u s"
10.33114/adim.2017.110,Using proximity in sustainable product design,2019,5,"sustainable development, environmental awareness, climate change, purchase intention"
10.4028/www.scientific.net/amm.887.48,Assessment of Color Degradation of Wood Plastic Composites in Outdoor Applications,2019,7,"marine debris, metric tons, human health, u s"
10.2478/jok-2019-0057,The Analysis of the Possibilities of Using 3D Printer for Making Components and Parts of Marine Equipment for Example Flexible Clutch Coupling,2019,3,"mechanical properties, tensile strength, polypropylene pp, injection molding"
10.22060/ceej.2019.16281.6181,Evaluation of Mechanical Behaviour of Reinforced Anzali port's sand with Poly-ethylene-therphthalate (PET),2019,4,"compressive strength, mechanical properties, flexural strength, tensile strength"
10.1088/1757-899x/542/1/012027,Study and comparison on mechanical properties of various polymers reinforced with ground tires rubber (GTR),2019,4,"compressive strength, mechanical properties, flexural strength, tensile strength"
10.2139/ssrn.3730754,Deglobalizing Garbage: U.S. Legislative Responses to Disruption of the Global Plastic Waste Supply Chain,2020,7,"marine debris, metric tons, human health, u s"
10.1088/1755-1315/616/1/012015,Indoor and Outdoor Particulate Matter Concentrations in the Vicinity of Plastic Waste Processing Industries,2020,6,"supply chain, climate change, environmental impacts, value chain"
10.1145/3444465.3444474,Actualization of Environmental Education as an Innovative and Digital Resource for Sustainable Regional Development,2020,5,"sustainable development, environmental awareness, climate change, purchase intention"
10.18260/1-2--21672,Materials Camp at UAB: Launching Technology to New Heights,2020,5,"sustainable development, environmental awareness, climate change, purchase intention"
10.2514/6.2020-0330,Teaching Space-Borne Recycling to Middle School Students via 3D Printing – Managing Classroom Air Quality,2020,7,"marine debris, metric tons, human health, u s"
10.18260/1-2--10446,Lessons With Lego® Engaging Students In Chemical Engineering Courses,2020,3,"mechanical properties, tensile strength, polypropylene pp, injection molding"
10.7236/ijasc.2020.9.1.70,A Study of Product Design using Recycled Materials,2020,7,"marine debris, metric tons, human health, u s"
10.2139/ssrn.3564039,Bioplastics from Agricultural Wastes,2020,7,"marine debris, metric tons, human health, u s"
10.1021/cen-09802-cover7,Pressured plastics firms will look to recycling,2020,7,"marine debris, metric tons, human health, u s"
10.1002/cssc.202002799,A Fresh Look at Sustainable Chemistry,2020,5,"sustainable development, environmental awareness, climate change, purchase intention"
10.18260/1-2--1998,Introducing Global Stewardship To Engineering Students In The Arab World: The Petroleum Institute's Steps Program Focuses On Sustainability,2020,5,"sustainable development, environmental awareness, climate change, purchase intention"
10.4028/www.scientific.net/msf.1010.130,Mechanical Properties of Recycled Polypropylene Filled with Aluminium Hydroxide,2020,3,"mechanical properties, tensile strength, polypropylene pp, injection molding"
10.14712/18023061.626,Environmental Awareness and Plastic Recycling Behaviour of Nigerian Undergraduates,2021,5,"sustainable development, environmental awareness, climate change, purchase intention"
10.1088/1755-1315/781/3/032030,Research on the Impact of Plastic Recycling Industry on Greenhouse Gas Emissions,2021,7,"marine debris, metric tons, human health, u s"
