doi,title,year,cluster,topic_label
10.1002/cite.202000119,Ultrasonic Degradation of Polystyrene for Tailoring Molecular Weight and Polydispersity of Polystyrene Fragments,2020,2,"polyethylene terephthalate pet, supporting information, molecular weight, pyrolysis oil"
10.32604/jrm.2020.09589,Experimental Research on the Physical and Mechanical Properties of Concrete with Recycled Plastic Aggregates,2020,4,"compressive strength, mechanical properties, flexural strength, tensile strength"
10.25130/tjes.28.3.01,The reality of solid waste management in Iraq and ways of development,2021,5,"sustainable development, environmental awareness, climate change, purchase intention"
10.3390/su13020689,The Feasibility of Using the MFC Concept to Upcycle Mixed Recycled Plastics,2021,3,"mechanical properties, tensile strength, polypropylene pp, injection molding"
10.3390/recycling7030036,Does Policy on Plastic Waste Support Higher Waste Management Hierarchy Options?,2022,6,"supply chain, climate change, environmental impacts, value chain"
10.4314/ijbcs.v11i5.27,"Etude sur la capacité de production, du circuit de commercialisation et de la consommation du <i>zoom-koom</i> vendu dans la ville de Ouagadougou au Burkina Faso",2018,6,"supply chain, climate change, environmental impacts, value chain"
10.1177/0734242x19867391,Analysis of mismanaged plastic waste in Samoa to suggest proper waste management in Pacific island countries,2019,7,"marine debris, metric tons, human health, u s"
10.1111/1462-2920.15119,Expanding the current knowledge and biotechnological applications of the oxygen‐independent <scp><i>ortho</i></scp>‐phthalate degradation pathway,2020,2,"polyethylene terephthalate pet, supporting information, molecular weight, pyrolysis oil"
10.3390/su13168678,Techno-Assessment of the Use of Recycled Plastic Waste in RE,2021,4,"compressive strength, mechanical properties, flexural strength, tensile strength"
10.28991/cej-2021-03091684,Performance Evaluation for Mechanical Behaviour of Concrete Incorporating Recycled Plastic Bottle Fibers as Locally Available Materials,2021,4,"compressive strength, mechanical properties, flexural strength, tensile strength"
10.1017/pds.2021.438,HOW SHOULD PLASTIC RECYCLATES LOOK LIKE TO BE PERCEIVED AS SUSTAINABLE: A FIRST EXPLORATION,2021,5,"sustainable development, environmental awareness, climate change, purchase intention"
10.1021/acs.est.0c07603,"Insights into Persistent Toxic Substances in Protective Cases of Mobile Phones: Occurrence, Health Risks, and Implications",2021,7,"marine debris, metric tons, human health, u s"
10.1002/rcm.9230,Untargeted selected ion flow tube mass spectrometry headspace analysis: High‐throughput differentiation of virgin and recycled polyethylene pellets,2021,3,"mechanical properties, tensile strength, polypropylene pp, injection molding"
10.3390/polym13091439,Degradation of Styrenic Plastics during Recycling: Accommodation of PP within ABS after WEEE Plastics Imperfect Sorting,2021,3,"mechanical properties, tensile strength, polypropylene pp, injection molding"
10.3141/1626-11,Sound Barrier Applications of Recycled Plastics,1998,4,"compressive strength, mechanical properties, flexural strength, tensile strength"
10.1061/40971(310)117,Static and Dynamic Load Tests on Driven Polymeric Piles,2008,7,"marine debris, metric tons, human health, u s"
10.31357/fesympo.v15i0.168,ANALYSIS OF ISSUES AND CONSTRAINTS ASSOCIATED WITH PLASTIC RECYCLING INDUSTRY IN SRI LANKA,2012,7,"marine debris, metric tons, human health, u s"
10.1539/joh.11-0202-oa,Does Open‐air Exposure to Volatile Organic Compounds near a Plastic Recycling Factory Cause Health Effects?,2012,7,"marine debris, metric tons, human health, u s"
10.1061/41204(426)72,World's First Recycled Plastic Bridges,2012,4,"compressive strength, mechanical properties, flexural strength, tensile strength"
10.1115/nawtec21-2727,Transforming the Non-Recycled Plastics of New York City to Synthetic Oil,2013,7,"marine debris, metric tons, human health, u s"
10.1061/9780784413272.301,Numerical Study of Slope Stabilization Using Recycled Plastic Pin,2014,4,"compressive strength, mechanical properties, flexural strength, tensile strength"
10.1177/0021998315591046,Effect of domestic compatabilizer on the performance of polypropylene-sawdust composites,2015,3,"mechanical properties, tensile strength, polypropylene pp, injection molding"
10.1002/fam.2480,Flammability of wood plastic composites prepared from plastic waste,2017,3,"mechanical properties, tensile strength, polypropylene pp, injection molding"
10.4172/2252-5211.1000265,The Role of Sub-Saharan Africa Countries’ Households Waste Charges on Sustainable Cities Development,2017,6,"supply chain, climate change, environmental impacts, value chain"
10.1007/s10163-023-01873-8,Dissolution recycling for recovery of polypropylene and glass fibres,2024,3,"mechanical properties, tensile strength, polypropylene pp, injection molding"
10.1016/j.hazadv.2024.100430,"Unveiling the Microplastic Crisis: Insights into Bangladesh's Aquatic Ecosystems - Origins, Impact, and Solutions",2024,7,"marine debris, metric tons, human health, u s"
10.3390/recycling10010001,Polymer Recycling: A Comprehensive Overview and Future Outlook,2024,2,"polyethylene terephthalate pet, supporting information, molecular weight, pyrolysis oil"
10.3389/frsus.2022.989720,Design of solvent-assisted plastics recycling: Integrated economics and environmental impacts analysis,2022,7,"marine debris, metric tons, human health, u s"
10.3390/recycling7050073,Potential Analysis of the Plastics Value Chain for Enhanced Recycling Rates: A Case Study in Iceland,2022,7,"marine debris, metric tons, human health, u s"
10.3390/su14116539,Transforming the Plastic Production System Presents Opportunities to Tackle the Climate Crisis,2022,7,"marine debris, metric tons, human health, u s"
10.3390/environments9010007,"Environmental Policy for the Restriction on the Use of Plastic Products in Taiwan: Regulatory Measures, Implementation Status and COVID-19’s Impacts on Plastic Products Recycling",2022,7,"marine debris, metric tons, human health, u s"
10.3389/fbuil.2022.882942,Thermal Performance Study of a Cement-Based Mortar Incorporating EPS Beads,2022,4,"compressive strength, mechanical properties, flexural strength, tensile strength"
10.1016/j.rcradv.2022.200127,Measuring the circularity potential of recycled LDPE based on quantity and quality conservation - a functional requirement matrix approach,2022,3,"mechanical properties, tensile strength, polypropylene pp, injection molding"
10.1088/2053-1591/ac96d4,Comparative property analysis of fused filament fabrication PLA using fresh and recycled feedstocks,2022,3,"mechanical properties, tensile strength, polypropylene pp, injection molding"
10.3390/su141710913,Designing a Recycling Network for the Circular Economy of Plastics with Different Multi-Criteria Optimization Approaches,2022,6,"supply chain, climate change, environmental impacts, value chain"
10.3390/w15071276,Magnetic Natural Coagulants for Plastic Recycling Industry Wastewater Treatability,2023,2,"polyethylene terephthalate pet, supporting information, molecular weight, pyrolysis oil"
10.1016/j.cec.2023.100066,A recycling technology selection framework for evaluating the effectiveness of plastic recycling technologies for circular economy advancement,2023,6,"supply chain, climate change, environmental impacts, value chain"
10.1111/jiec.13384,Plastic value chain and performance metric framework for optimal recycling,2023,6,"supply chain, climate change, environmental impacts, value chain"
10.1002/suco.202200949,Combined effects of biochar and recycled plastic aggregates on mechanical behavior of concrete,2023,4,"compressive strength, mechanical properties, flexural strength, tensile strength"
10.1111/jiec.13409,Recycling plastics from e‐waste: Implications for effective eco‐design,2023,7,"marine debris, metric tons, human health, u s"
10.1016/j.resconrec.2023.107329,Assessment of microplastics production from waste plastics-modified asphalt pavement,2023,4,"compressive strength, mechanical properties, flexural strength, tensile strength"
10.1016/j.chemosphere.2023.140781,Enhancing polyethylene terephthalate conversion through efficient microwave-assisted deep eutectic solvent-catalyzed glycolysis,2023,2,"polyethylene terephthalate pet, supporting information, molecular weight, pyrolysis oil"
10.1016/j.resconrec.2024.107599,Influence of plastic packaging design on the sensor-based sortability in lightweight packaging waste sorting plants,2024,7,"marine debris, metric tons, human health, u s"
10.1016/j.envdev.2024.100986,A Framework to Support Localized Solid Waste Management Decision Making: Evidence from Qatar,2024,5,"sustainable development, environmental awareness, climate change, purchase intention"
10.1038/s41467-024-54786-x,Polyethylene hydrogenolysis by dilute RuPt alloy to achieve H2-pressure-independent low methane selectivity,2024,2,"polyethylene terephthalate pet, supporting information, molecular weight, pyrolysis oil"
10.1002/anie.202419535,Structural and Functional Characterization of an Amidase Targeting a Polyurethane for Sustainable Recycling,2024,2,"polyethylene terephthalate pet, supporting information, molecular weight, pyrolysis oil"
10.1080/09243046.2024.2322799,"Experimental investigation of eco-friendly fiber-reinforced concrete using recycled and natural fibers, integrated with recycled aggregates",2024,4,"compressive strength, mechanical properties, flexural strength, tensile strength"
10.3390/su142013494,Flexural Behavior of Portland Cement Mortars Reinforced with Hybrid Blends of Recycled Waste Fibers,2022,4,"compressive strength, mechanical properties, flexural strength, tensile strength"
10.3390/jcs6110332,Recycled Carbon Nanofiber-Polypropylene Nanocomposite: A Step towards Sustainable Structural Material Development,2022,3,"mechanical properties, tensile strength, polypropylene pp, injection molding"
10.3390/polym14153109,The Reinforcing Effect of Waste Polyester Fiber on Recycled Polyethylene,2022,3,"mechanical properties, tensile strength, polypropylene pp, injection molding"
10.1021/acs.jpca.2c01167,Reactive Molecular Dynamics Simulations of the Depolymerization of Polyethylene Using Graphene-Oxide-Supported Platinum Nanoparticles,2022,2,"polyethylene terephthalate pet, supporting information, molecular weight, pyrolysis oil"
10.61078/jsi.v1i2.9,The Challenges and Future of Marine Debris Policy in Indonesia and Taiwan Case Studies,2022,7,"marine debris, metric tons, human health, u s"
10.1016/j.dib.2023.109054,NIR-MFCO dataset: Near-infrared-based false-color images of post-consumer plastics at different material flow compositions and material flow presentations,2023,3,"mechanical properties, tensile strength, polypropylene pp, injection molding"
10.1038/s41598-023-43042-9,"A metagenomic catalog for exploring the plastizymes landscape covering taxa, genes, and proteins",2023,2,"polyethylene terephthalate pet, supporting information, molecular weight, pyrolysis oil"
10.1111/1462-2920.16512,A lesson from polybutylene succinate plastisphere to the discovery of novel plastic degrading enzyme genes in marine vibrios,2023,2,"polyethylene terephthalate pet, supporting information, molecular weight, pyrolysis oil"
10.1021/acscatal.3c03269,Homogeneous Catalysis in Plastic Waste Upcycling: A DFT Study on the Role of Imperfections in Polymer Chains,2023,2,"polyethylene terephthalate pet, supporting information, molecular weight, pyrolysis oil"
10.3389/fenvs.2023.1175392,Spectral preprocessing combined with feature selection improve model robustness for plastics samples classification by LIBS,2023,3,"mechanical properties, tensile strength, polypropylene pp, injection molding"
10.1002/pc.27549,Fabrication of flame‐retardant wood plastic composites based on wasted bean dregs with recycled <scp>PE</scp> via mechanochemical crosslinking,2023,3,"mechanical properties, tensile strength, polypropylene pp, injection molding"
10.1016/j.cegh.2023.101286,Informal plastic waste recycling firms in rural eastern India: Implications for livelihood and health,2023,5,"sustainable development, environmental awareness, climate change, purchase intention"
10.3390/polym15030776,Exploring the Surface Potential of Recycled Polyethylene Terephthalate Composite Supports on the Collagen Contamination Level,2023,3,"mechanical properties, tensile strength, polypropylene pp, injection molding"
10.1039/d4ay00667d,<i>In situ</i> dissolved polypropylene prediction by Raman and ATR-IR spectroscopy for its recycling,2024,2,"polyethylene terephthalate pet, supporting information, molecular weight, pyrolysis oil"
10.1039/d4mr00098f,Influence of ball milling parameters on the mechano-chemical conversion of polyolefins,2024,3,"mechanical properties, tensile strength, polypropylene pp, injection molding"
10.4491/ksee.2024.46.7.395,Waste Plastic Pyrolysis Industry: Current Status and Prospects,2024,6,"supply chain, climate change, environmental impacts, value chain"
10.1016/j.xcrp.2024.101783,A general route to retooling hydrolytic enzymes toward plastic degradation,2024,2,"polyethylene terephthalate pet, supporting information, molecular weight, pyrolysis oil"
10.1016/j.scitotenv.2024.176832,Abiotic degradation and accelerated ageing of microplastics from biodegradable and recycled materials in artificial seawater,2024,2,"polyethylene terephthalate pet, supporting information, molecular weight, pyrolysis oil"
10.1002/anie.202404196,Plasma‐Enabled Process with Single‐Atom Catalysts for Sustainable Plastic Waste Transformation,2024,2,"polyethylene terephthalate pet, supporting information, molecular weight, pyrolysis oil"
10.1007/s43615-024-00367-5,Addressing Plastic Concern: Behavioral Insights into Recycled Plastic Products and Packaging in a Circular Economy,2024,7,"marine debris, metric tons, human health, u s"
10.1007/s43939-024-00126-1,Comprehensive review on the use of plastic waste in sustainable concrete construction,2024,6,"supply chain, climate change, environmental impacts, value chain"
10.3390/buildings14030609,Sustainable Structural Lightweight Concrete with Recycled Polyethylene Terephthalate Waste Aggregate,2024,4,"compressive strength, mechanical properties, flexural strength, tensile strength"
10.1016/j.jclepro.2024.143818,The manufacturing process and consequent occupational health and environmental risks associated with the use of plastic waste in construction bricks in small-scale recycling plants,2024,7,"marine debris, metric tons, human health, u s"
10.1021/jf9804950,Assessing the Suitability of Recycled Plastics Used as Agricultural Soil Covers: Migration Study and Experimental Harvest,1998,6,"supply chain, climate change, environmental impacts, value chain"
10.1080/00039890109604452,Short-Term Adverse Health Effects in a Community Exposed to a Large Polyvinylchloride Plastics Fire,2001,7,"marine debris, metric tons, human health, u s"
10.3141/1808-18,Durability of Recycled Fiber-Reinforced Polymer Piling in Aggressive Environments,2002,4,"compressive strength, mechanical properties, flexural strength, tensile strength"
10.4144/rpsj.50.182,Development of Waste Plastics Recycling Process Using Coke Ovens.,2003,6,"supply chain, climate change, environmental impacts, value chain"
10.3141/1849-04,Field Performance of Embankments Stabilized with Recycled Plastic Reinforcement,2003,4,"compressive strength, mechanical properties, flexural strength, tensile strength"
10.1002/mame.200500180,"Processability and Properties of Re-Graded, Photo-Oxidized Post-Consumer Greenhouse Films",2005,3,"mechanical properties, tensile strength, polypropylene pp, injection molding"
10.1002/pen.20961,Weathering of recycled photo‐degraded polyethylene,2007,3,"mechanical properties, tensile strength, polypropylene pp, injection molding"
10.4144/rpsj.54.29,Assessing Different Recycling Options for Plastic Wastes from Discarded Mobile Phones in the Context of LCA,2007,6,"supply chain, climate change, environmental impacts, value chain"
10.5850/jksct.2010.34.3.529,Green Marketing in the Fashion Industry,2010,5,"sustainable development, environmental awareness, climate change, purchase intention"
10.22219/jtiumm.vol13.no1.93-100,Meningkatkan Mutu Produk Plastik Dengan Metode Taguchi,2012,3,"mechanical properties, tensile strength, polypropylene pp, injection molding"
10.5963/ijep0501001,Feasibility and Performance Evaluation of Different Low-Tech Composter Prototypes,2015,6,"supply chain, climate change, environmental impacts, value chain"
10.1063/1.4918507,Thermal process-dependence of the mechanical properties and inner structures of pre-consumer recycled polypropylene,2015,3,"mechanical properties, tensile strength, polypropylene pp, injection molding"
10.1177/1420326x16665896,"The benefits of an eco-productive green roof in Bogota, Colombia",2016,5,"sustainable development, environmental awareness, climate change, purchase intention"
10.15282/jmes.11.4.2017.16.0282,Utilisation of recycled thermoplastics sourced from rejected-unused disposable diapers as polymer blends,2017,3,"mechanical properties, tensile strength, polypropylene pp, injection molding"
10.1108/prt-07-2016-0072,Preparation and characterisation of water soluble polyester coatings based on waste materials,2017,2,"polyethylene terephthalate pet, supporting information, molecular weight, pyrolysis oil"
10.18178/ijesd.2018.9.7.1094,An Agricultural Waste Based Composite to Replace or Reduce the Use of Plastics,2018,2,"polyethylene terephthalate pet, supporting information, molecular weight, pyrolysis oil"
10.29007/nwsh,Impact Resistance of Geopolymer Concrete Containing Recycled Plastic Aggregates,2018,4,"compressive strength, mechanical properties, flexural strength, tensile strength"
10.1051/e3sconf/20183401014,Panel Board From Coconut Fibre And Pet Bottle,2018,3,"mechanical properties, tensile strength, polypropylene pp, injection molding"
10.1155/2018/7361798,The Comprehensive Comparison of Thermal and Physical‐Mechanical Properties of the Recycled Rubber and Plastic Roofing Tiles versus Roofing Tiles Made with Different Traditional Materials,2018,3,"mechanical properties, tensile strength, polypropylene pp, injection molding"
10.1016/j.rcrx.2019.100011,Opportunities for chemical recycling to benefit from waste policy changes in the United Kingdom,2019,7,"marine debris, metric tons, human health, u s"
10.1111/sjtg.12324,Environmental change and the informal plastic recycling networks of Kolkata,2020,5,"sustainable development, environmental awareness, climate change, purchase intention"
10.3167/jla.2020.040106,COVID-19 as method,2020,5,"sustainable development, environmental awareness, climate change, purchase intention"
10.1109/ghtc46280.2020.9342915,Comparing the Properties of Polyethylene Terephthalate (PET) Plastic Bricks to Conventional Concrete Masonry Units,2020,4,"compressive strength, mechanical properties, flexural strength, tensile strength"
10.4467/22996834flr.20.018.13090,Own resources in the light of European Council Conclusions on the MFF and next generation EU,2020,6,"supply chain, climate change, environmental impacts, value chain"
10.32933/actainnovations.37.5,Potential contribution of nanotechnolgy to the circular economy of plastic materials,2020,2,"polyethylene terephthalate pet, supporting information, molecular weight, pyrolysis oil"
10.3390/recycling6010017,Mechanical and Market Study for Sand/Recycled-Plastic Cobbles in a Medium-Size Colombian City,2021,4,"compressive strength, mechanical properties, flexural strength, tensile strength"
10.1016/j.clet.2021.100219,Particle trajectory model for tribo-electrostatic separating mixed granular plastics,2021,3,"mechanical properties, tensile strength, polypropylene pp, injection molding"
10.1061/(asce)cc.1943-5614.0001156,Cyclic Compressive Behavior of Hybrid FRP-Confined Concrete,2021,4,"compressive strength, mechanical properties, flexural strength, tensile strength"
10.1088/1755-1315/950/1/012010,Quantification of Riverbank Macroplastic Contamination in The Lower Citarum River,2022,7,"marine debris, metric tons, human health, u s"
10.1109/comsnets53615.2022.9668574,A Blockchain Based Transparent Framework for Plastic Waste Management,2022,6,"supply chain, climate change, environmental impacts, value chain"
10.1080/15567036.2022.2115582,"Experimental investigation of performance, emission and combustion characteristics of a CI engine fuelled by blends of waste plastic oil with diesel",2022,2,"polyethylene terephthalate pet, supporting information, molecular weight, pyrolysis oil"
10.1111/jiec.13496,Evaluating strategies to increase PET bottle recycling in the United States,2024,7,"marine debris, metric tons, human health, u s"
10.3390/su16219515,The Factors Influencing the Recycling of Plastic and Composite Packaging Waste,2024,7,"marine debris, metric tons, human health, u s"
10.3390/su16145852,An Industrial Perspective for Sustainable Polypropylene Plastic Waste Management via Catalytic Pyrolysis—A Technical Report,2024,2,"polyethylene terephthalate pet, supporting information, molecular weight, pyrolysis oil"
10.1016/j.resconrec.2024.107889,Application of solvent-based dissolution for the recycling of polyvinylchloride flooring waste containing restricted phthalate plasticizers,2024,2,"polyethylene terephthalate pet, supporting information, molecular weight, pyrolysis oil"
10.1021/jacs.4c05952,Synthesis and Thermo-Selective Recycling of Diels–Alder Cyclopentadiene Thermoplastics,2024,2,"polyethylene terephthalate pet, supporting information, molecular weight, pyrolysis oil"
10.1021/jacs.4c15500,Nitrogenative Degradation of Polystyrene Waste,2025,2,"polyethylene terephthalate pet, supporting information, molecular weight, pyrolysis oil"
10.1017/plc.2025.1,Addressing the toxic chemicals problem in plastics recycling,2025,7,"marine debris, metric tons, human health, u s"
10.1002/vnl.10152,Advanced recycling technology for unsorted plastic waste,1996,3,"mechanical properties, tensile strength, polypropylene pp, injection molding"
10.1002/masy.19981350131,Polymer recycling: Thermodynamics and economics,1998,6,"supply chain, climate change, environmental impacts, value chain"
10.1106/fmg9-meqy-mp7j-99nr,Tertiary Recycling of Automotive Plastics and Composites,2000,3,"mechanical properties, tensile strength, polypropylene pp, injection molding"
10.1109/ecodim.2005.1619290,Recycling of Cable Plastics - A Life Cycle Assessment of Several Different Alternatives,2006,6,"supply chain, climate change, environmental impacts, value chain"
10.5455/pmb.20101223040454,Plastic food packaging and health,2011,7,"marine debris, metric tons, human health, u s"
10.1002/pen.23327,The effect of recycled polymer addition on the thermorheological behavior of modified lubricating greases,2012,3,"mechanical properties, tensile strength, polypropylene pp, injection molding"
10.17628/ecb.2014.3.93-97,ACTIVATION ENERGY FOR THE PYROLYSIS OF POLYMERIC WASTES,2013,2,"polyethylene terephthalate pet, supporting information, molecular weight, pyrolysis oil"
10.1177/0021998314533714,Simultaneous optimization of the mechanical properties of postconsumer natural fiber/plastic composites: Processing analysis,2014,3,"mechanical properties, tensile strength, polypropylene pp, injection molding"
10.1061/(asce)ey.1943-7897.0000263,Special Issue on Contemporary Combustion Experimentation and Modeling for Clean and Efficient Power Generation: Issues and Challenges,2014,6,"supply chain, climate change, environmental impacts, value chain"
10.1177/0954409715620755,"Effect of pre-drilling, loading rate and temperature variation on the behavior of railroad spikes used for high-density-polyethylene crossties",2015,4,"compressive strength, mechanical properties, flexural strength, tensile strength"
10.2139/ssrn.2781933,A Cost-Effectiveness Analysis for Incineration or Recycling of Dutch Household Plastics,2016,6,"supply chain, climate change, environmental impacts, value chain"
10.1088/1757-899x/111/1/012027,Polymer sand composites based on the mixed and heavily contaminated thermoplastic waste,2016,3,"mechanical properties, tensile strength, polypropylene pp, injection molding"
10.4314/njt.v36i2.13,Finite element analysis of plastic recycling machine designed for production of thin filament coil,2017,3,"mechanical properties, tensile strength, polypropylene pp, injection molding"
10.23919/picmet.2018.8481786,A Model Template Green Environment Initiative for Recycling Plastic Bottles with Progressive Entrepreneurship Partnership,2018,7,"marine debris, metric tons, human health, u s"
10.1007/s42452-022-05036-6,Structural behavior of hollow-core reinforced self-compacting concrete beams,2022,4,"compressive strength, mechanical properties, flexural strength, tensile strength"
10.28991/cej-2022-08-11-09,Sustainability Performance of Voided Concrete Slab Using Waste Plastic Bottles,2022,6,"supply chain, climate change, environmental impacts, value chain"
10.1016/j.cscm.2022.e01681,The effect of using shredded plastic on the behavior of reinforced concrete slab,2022,4,"compressive strength, mechanical properties, flexural strength, tensile strength"
10.3390/polym14040744,A New Look at the Chemical Recycling of Polypropylene: Thermal Oxidative Destruction in Aqueous Oxygen-Enriched Medium,2022,3,"mechanical properties, tensile strength, polypropylene pp, injection molding"
10.1515/gps-2022-0014,Developing a plastic cycle toward circular economy practice,2022,7,"marine debris, metric tons, human health, u s"
10.3390/polym14235171,Efficient Depolymerization of Glass Fiber Reinforced PET Composites,2022,2,"polyethylene terephthalate pet, supporting information, molecular weight, pyrolysis oil"
