doi,title,year,cluster,topic_label
10.1002/pol.20190261,Advances and approaches for chemical recycling of plastic waste,2020,2,"polyethylene terephthalate pet, supporting information, molecular weight, pyrolysis oil"
10.1126/science.abc5441,Polyethylene upcycling to long-chain alkylaromatics by tandem hydrogenolysis/aromatization,2020,2,"polyethylene terephthalate pet, supporting information, molecular weight, pyrolysis oil"
10.1002/macp.201200439,Green Polymer Chemistry and Bio‐based Plastics: Dreams and Reality,2012,7,"marine debris, metric tons, human health, u s"
10.1016/j.wasman.2020.12.020,Plastic recycling in a circular economy; determining environmental performance through an LCA matrix model approach,2021,7,"marine debris, metric tons, human health, u s"
10.1021/acscatal.2c01286,Rational Design of Chemical Catalysis for Plastic Recycling,2022,2,"polyethylene terephthalate pet, supporting information, molecular weight, pyrolysis oil"
10.3390/su151410821,Microplastics as an Emerging Threat to the Global Environment and Human Health,2023,7,"marine debris, metric tons, human health, u s"
10.1126/science.254.5029.231,Reactivity of Organic Compounds in Hot Water: Geochemical and Technological Implications,1991,2,"polyethylene terephthalate pet, supporting information, molecular weight, pyrolysis oil"
10.1039/c8py01284a,Organocatalysis for depolymerisation,2018,2,"polyethylene terephthalate pet, supporting information, molecular weight, pyrolysis oil"
10.1021/acsapm.1c00648,Why is Recycling of Postconsumer Plastics so Challenging?,2021,7,"marine debris, metric tons, human health, u s"
10.1108/13552541311302978,Distributed recycling of waste polymer into RepRap feedstock,2013,6,"supply chain, climate change, environmental impacts, value chain"
10.1016/j.ymben.2021.03.011,Towards bio-upcycling of polyethylene terephthalate,2021,2,"polyethylene terephthalate pet, supporting information, molecular weight, pyrolysis oil"
10.1021/ie990512q,Catalytic Degradation of High-Density Polyethylene over Different Zeolitic Structures,2000,2,"polyethylene terephthalate pet, supporting information, molecular weight, pyrolysis oil"
10.1021/acscatal.1c00874,Polypropylene Plastic Waste Conversion to Lubricants over Ru/TiO<sub>2</sub> Catalysts,2021,2,"polyethylene terephthalate pet, supporting information, molecular weight, pyrolysis oil"
10.1002/pen.760301109,Composites from compounding wood fibers with recycled high density polyethylene,1990,3,"mechanical properties, tensile strength, polypropylene pp, injection molding"
10.1117/12.777776,"Overview of SWIR detectors, cameras, and applications",2008,6,"supply chain, climate change, environmental impacts, value chain"
10.1111/jiec.12822,Quality Assessment and Circularity Potential of Recovery Systems for Household Plastic Waste,2018,6,"supply chain, climate change, environmental impacts, value chain"
10.3390/su12052088,Effect of Bio-Based Products on Waste Management,2020,7,"marine debris, metric tons, human health, u s"
10.3390/su10051487,Impact of Bio-Based Plastics on Current Recycling of Plastics,2018,7,"marine debris, metric tons, human health, u s"
10.1111/1751-7915.12312,Plastic waste as a novel substrate for industrial biotechnology,2015,7,"marine debris, metric tons, human health, u s"
10.3390/ma12101642,Mechanical Properties and Applications of Recycled Polycarbonate Particle Material Extrusion-Based Additive Manufacturing,2019,3,"mechanical properties, tensile strength, polypropylene pp, injection molding"
10.1177/0022242919842167,Knowing What It Makes: How Product Transformation Salience Increases Recycling,2019,5,"sustainable development, environmental awareness, climate change, purchase intention"
10.1093/reep/rez012,"Marine Plastic Pollution: Sources, Impacts, and Policy Issues",2019,7,"marine debris, metric tons, human health, u s"
10.1021/acs.chemmater.0c02008,Sustainable Materials and Chemical Processes for Additive Manufacturing,2020,2,"polyethylene terephthalate pet, supporting information, molecular weight, pyrolysis oil"
10.1016/j.pecs.2022.101046,Challenges and opportunities of light olefin production via thermal and catalytic pyrolysis of end-of-life polyolefins: Towards full recyclability,2023,2,"polyethylene terephthalate pet, supporting information, molecular weight, pyrolysis oil"
10.1016/j.resconrec.2022.106219,Consumers’ sustainability-related perception of and willingness-to-pay for food packaging alternatives,2022,5,"sustainable development, environmental awareness, climate change, purchase intention"
10.1021/acsami.0c16489,Waste Plastic Triboelectric Nanogenerators Using Recycled Plastic Bags for Power Generation,2020,2,"polyethylene terephthalate pet, supporting information, molecular weight, pyrolysis oil"
10.1016/j.aiepr.2021.06.003,Recycling of medical plastics,2021,7,"marine debris, metric tons, human health, u s"
10.1016/j.rser.2012.02.064,Future perspectives on sustainable tribology,2012,6,"supply chain, climate change, environmental impacts, value chain"
10.1061/(asce)cc.1943-5614.0000386,Cyclic Compressive Behavior of Concrete Confined with Large Rupture Strain FRP Composites,2013,4,"compressive strength, mechanical properties, flexural strength, tensile strength"
10.1021/acscatal.2c02275,Multiple Substrate Binding Mode-Guided Engineering of a Thermophilic PET Hydrolase,2022,2,"polyethylene terephthalate pet, supporting information, molecular weight, pyrolysis oil"
10.1021/acssuschemeng.8b00750,"Exploring Comparative Energy and Environmental Benefits of Virgin, Recycled, and Bio-Derived PET Bottles",2018,7,"marine debris, metric tons, human health, u s"
10.1002/jctb.2323,Supercritical water for environmental technologies,2010,2,"polyethylene terephthalate pet, supporting information, molecular weight, pyrolysis oil"
10.1177/0008125617752695,Disruptive Technology as an Enabler of the Circular Economy: What Potential Does 3D Printing Hold?,2018,6,"supply chain, climate change, environmental impacts, value chain"
10.1177/0734242x09345868,Recycling of plastic: accounting of greenhouse gases and global warming contributions,2009,6,"supply chain, climate change, environmental impacts, value chain"
10.1111/1751-7915.13328,"Plastic waste management, a matter for the ‘community’",2018,7,"marine debris, metric tons, human health, u s"
10.1038/s41467-024-45662-9,Computational redesign of a hydrolase for nearly complete PET depolymerization at industrially relevant high-solids loading,2024,2,"polyethylene terephthalate pet, supporting information, molecular weight, pyrolysis oil"
10.1021/bm990007c,Lipase-Catalyzed Degradation of Polyesters in Organic Solvents. A New Methodology of Polymer Recycling Using Enzyme as Catalyst,2000,2,"polyethylene terephthalate pet, supporting information, molecular weight, pyrolysis oil"
10.1177/0036850419867204,"Solving the plastic problem: From cradle to grave, to reincarnation",2019,7,"marine debris, metric tons, human health, u s"
10.1089/3dp.2019.0195,Mechanical Properties of Direct Waste Printing of Polylactic Acid with Universal Pellets Extruder: Comparison to Fused Filament Fabrication on Open-Source Desktop Three-Dimensional Printers,2020,3,"mechanical properties, tensile strength, polypropylene pp, injection molding"
10.1016/j.egypro.2018.11.160,Employment the plastic waste to produce the light weight concrete,2019,4,"compressive strength, mechanical properties, flexural strength, tensile strength"
10.1021/acsnano.0c02878,Direct Observation of the Release of Nanoplastics from Commercially Recycled Plastics with Correlative Raman Imaging and Scanning Electron Microscopy,2020,2,"polyethylene terephthalate pet, supporting information, molecular weight, pyrolysis oil"
10.1021/acssuschemeng.4c02551,Plastic Waste Recycling─A Chemical Recycling Perspective,2024,7,"marine debris, metric tons, human health, u s"
10.1002/1616-5195(20020401)2:3<105::aid-mabi105>3.0.co;2-k,Enzyme-Catalyzed Synthesis and Chemical Recycling of Polyesters,2002,2,"polyethylene terephthalate pet, supporting information, molecular weight, pyrolysis oil"
10.1002/jctb.1757,Catalytic conversion of waste plastics: focus on waste PVC,2007,2,"polyethylene terephthalate pet, supporting information, molecular weight, pyrolysis oil"
10.1002/anie.202211806,Closed‐Loop Recycling of Poly(Imine‐Carbonate) Derived from Plastic Waste and Bio‐based Resources,2022,2,"polyethylene terephthalate pet, supporting information, molecular weight, pyrolysis oil"
10.1002/pi.6555,Bioplastic: an eco‐friendly alternative to non‐biodegradable plastic,2023,7,"marine debris, metric tons, human health, u s"
10.1016/j.hazadv.2023.100309,The potential for a plastic recycling facility to release microplastic pollution and possible filtration remediation effectiveness,2023,7,"marine debris, metric tons, human health, u s"
10.3390/polym14081583,"Forecasting the Mechanical Properties of Plastic Concrete Employing Experimental Data Using Machine Learning Algorithms: DT, MLPNN, SVM, and RF",2022,4,"compressive strength, mechanical properties, flexural strength, tensile strength"
10.3390/ma12172740,Miniaturized Near-Infrared (MicroNIR) Spectrometer in Plastic Waste Sorting,2019,3,"mechanical properties, tensile strength, polypropylene pp, injection molding"
10.1021/jacs.1c05330,Depolymerization of Hydroxylated Polymers via Light-Driven C–C Bond Cleavage,2021,2,"polyethylene terephthalate pet, supporting information, molecular weight, pyrolysis oil"
10.1021/es404646e,Nanosized Carbon Black Combined with Ni<sub>2</sub>O<sub>3</sub> as “Universal” Catalysts for Synergistically Catalyzing Carbonization of Polyolefin Wastes to Synthesize Carbon Nanotubes and Application for Supercapacitors,2014,2,"polyethylene terephthalate pet, supporting information, molecular weight, pyrolysis oil"
10.1021/acssuschemeng.2c01708,"Selective, Sequential, and “One-Pot” Depolymerization Strategies for Chemical Recycling of Commercial Plastics and Mixed Plastics",2022,2,"polyethylene terephthalate pet, supporting information, molecular weight, pyrolysis oil"
10.1016/j.resconrec.2023.106916,How much can chemical recycling contribute to plastic waste recycling in Europe? An assessment using material flow analysis modeling,2023,7,"marine debris, metric tons, human health, u s"
10.3390/recycling7020011,Assessment of Performance and Challenges in Use of Commercial Automated Sorting Technology for Plastic Waste,2022,7,"marine debris, metric tons, human health, u s"
10.1016/j.envint.2020.105559,Toxicity evaluation of E-waste plastics and potential repercussions for human health,2020,7,"marine debris, metric tons, human health, u s"
10.1021/acsengineeringau.2c00029,Chemical Recycling of Used PET by Glycolysis Using Niobia-Based Catalysts,2023,2,"polyethylene terephthalate pet, supporting information, molecular weight, pyrolysis oil"
10.1186/s12302-020-00390-x,Pyrolysis kinetic modelling of abundant plastic waste (PET) and in-situ emission monitoring,2020,2,"polyethylene terephthalate pet, supporting information, molecular weight, pyrolysis oil"
10.1021/acs.est.0c03435,"Dynamic Material Flow Analysis of PET, PE, and PP Flows in Europe: Evaluation of the Potential for Circular Economy",2020,6,"supply chain, climate change, environmental impacts, value chain"
10.1002/mar.21323,"It might be ethical, but I won't buy it: Perceived contamination of, and disgust towards, clothing made from recycled plastic bottles",2019,5,"sustainable development, environmental awareness, climate change, purchase intention"
10.1595/205651319x15574756736831,Closed-Loop Recycling of Polymers Using Solvents,2019,7,"marine debris, metric tons, human health, u s"
10.1016/j.jclepro.2023.137824,The circular economy and consumer behaviour: Literature review and research directions,2023,6,"supply chain, climate change, environmental impacts, value chain"
10.1080/14680629.2016.1207554,Storage stability and high-temperature performance of asphalt binder modified with recycled plastic,2016,4,"compressive strength, mechanical properties, flexural strength, tensile strength"
10.3390/ma13081827,Characteristics of Recycled Polypropylene Fibers as an Addition to Concrete Fabrication Based on Portland Cement,2020,4,"compressive strength, mechanical properties, flexural strength, tensile strength"
10.3390/polym13101574,Characterization of Composition and Structure–Property Relationships of Commercial Post-Consumer Polyethylene and Polypropylene Recyclates,2021,3,"mechanical properties, tensile strength, polypropylene pp, injection molding"
10.3390/su13169142,Efficient Plastic Recycling and Remolding Circular Economy Using the Technology of Trust–Blockchain,2021,7,"marine debris, metric tons, human health, u s"
10.1016/j.mtsust.2023.100529,"Additive manufacturing for sustainability and circular economy: needs, challenges, and opportunities for 3D printing of recycled polymeric waste",2023,7,"marine debris, metric tons, human health, u s"
10.1016/j.mset.2019.08.002,Utilization and recycling of end of life plastics for sustainable and clean industrial processes including the iron and steel industry,2019,7,"marine debris, metric tons, human health, u s"
10.1021/acs.est.8b04252,Screening and Characterization of Novel Polyesterases from Environmental Metagenomes with High Hydrolytic Activity against Synthetic Polyesters,2018,2,"polyethylene terephthalate pet, supporting information, molecular weight, pyrolysis oil"
10.1002/anie.201810605,Base‐Free Iron Catalyzed Transfer Hydrogenation of Esters Using EtOH as Hydrogen Source,2018,2,"polyethylene terephthalate pet, supporting information, molecular weight, pyrolysis oil"
10.1177/0731684407072519,Water Absorption Behavior of Composites from Sawdust and Recycled Plastics,2007,3,"mechanical properties, tensile strength, polypropylene pp, injection molding"
10.3390/su14020824,Recycling of Post-Consumer Packaging Materials into New Food Packaging Applications—Critical Review of the European Approach and Future Perspectives,2022,7,"marine debris, metric tons, human health, u s"
10.1016/j.resconrec.2020.105191,The future of UK plastics recycling: One Bin to Rule Them All,2020,7,"marine debris, metric tons, human health, u s"
10.1088/1742-6596/1808/1/012015,Natural Fiber Reinforced Polymer in Automotive Application: A Systematic Literature Review,2021,7,"marine debris, metric tons, human health, u s"
10.1021/jacs.1c08888,Sustainable Bioplastic Made from Biomass DNA and Ionomers,2021,2,"polyethylene terephthalate pet, supporting information, molecular weight, pyrolysis oil"
10.1021/acs.macromol.1c02085,A “Polymer to Polymer” Chemical Recycling of PLA Plastics by the “DE–RE Polymerization” Strategy,2022,2,"polyethylene terephthalate pet, supporting information, molecular weight, pyrolysis oil"
10.1021/acs.chemmater.2c02853,Polyolefins Vitrimers: Design Principles and Applications,2022,2,"polyethylene terephthalate pet, supporting information, molecular weight, pyrolysis oil"
10.1016/j.egyr.2021.12.072,"Waste to energy: Facile, low-cost and environment-friendly triboelectric nanogenerators using recycled plastic and electronic wastes for self-powered portable electronics",2022,7,"marine debris, metric tons, human health, u s"
10.1002/adfm.202210283,Photothermal Catalytic Polyester Upcycling over Cobalt Single‐Site Catalyst,2022,2,"polyethylene terephthalate pet, supporting information, molecular weight, pyrolysis oil"
10.1177/0892705719856063,"On investigation of rheological, mechanical and morphological characteristics of waste polymer-based feedstock filament for 3D printing applications",2019,3,"mechanical properties, tensile strength, polypropylene pp, injection molding"
10.1061/(asce)mt.1943-5533.0001765,Production of Recycled Plastic Aggregates and Its Utilization in Concrete,2016,4,"compressive strength, mechanical properties, flexural strength, tensile strength"
10.1016/j.engmic.2021.100003,Potential one-step strategy for PET degradation and PHB biosynthesis through co-cultivation of two engineered microorganisms,2021,2,"polyethylene terephthalate pet, supporting information, molecular weight, pyrolysis oil"
10.1038/s41598-022-09148-2,Energy recovery of waste plastics into diesel fuel with ethanol and ethoxy ethyl acetate additives on circular economy strategy,2022,6,"supply chain, climate change, environmental impacts, value chain"
,Role of Oxidative Stress in Male Reproductive Dysfunctions with Reference to Phthalate Compounds.,2015,2,"polyethylene terephthalate pet, supporting information, molecular weight, pyrolysis oil"
10.1002/bse.3009,Building a data‐driven circular supply chain hierarchical structure: Resource recovery implementation drives circular business strategy,2022,6,"supply chain, climate change, environmental impacts, value chain"
10.3390/recycling5040027,Pros and Cons of Plastic during the COVID-19 Pandemic,2020,5,"sustainable development, environmental awareness, climate change, purchase intention"
10.1366/10-06079a,Identification of Polymer Materials Using Laser-Induced Breakdown Spectroscopy Combined with Artificial Neural Networks,2011,3,"mechanical properties, tensile strength, polypropylene pp, injection molding"
10.1111/jiec.13393,Potentials and limits of mechanical plastic recycling,2023,7,"marine debris, metric tons, human health, u s"
10.1016/j.heliyon.2018.e00559,Durability of wood plastic composites manufactured from recycled plastic,2018,3,"mechanical properties, tensile strength, polypropylene pp, injection molding"
10.3389/fmicb.2020.00689,UV Pretreatment Impairs the Enzymatic Degradation of Polyethylene Terephthalate,2020,2,"polyethylene terephthalate pet, supporting information, molecular weight, pyrolysis oil"
10.1016/j.matpr.2020.05.176,Recycling of high impact polystyrene and low-density polyethylene plastic wastes in lightweight based concrete for sustainable construction,2020,4,"compressive strength, mechanical properties, flexural strength, tensile strength"
10.1128/aem.44.4.960-964.1982,Microwave sterilization of plastic tissue culture vessels for reuse,1982,3,"mechanical properties, tensile strength, polypropylene pp, injection molding"
10.1155/2013/496207,Processing and Validation of Whey-Protein-Coated Films and Laminates at Semi-Industrial Scale as Novel Recyclable Food Packaging Materials with Excellent Barrier Properties,2013,3,"mechanical properties, tensile strength, polypropylene pp, injection molding"
10.3390/ma8115406,"Mechanical, Thermomechanical and Reprocessing Behavior of Green Composites from Biodegradable Polymer and Wood Flour",2015,3,"mechanical properties, tensile strength, polypropylene pp, injection molding"
10.1016/j.jaap.2022.105793,Plastic pyrolysis over HZSM-5 zeolite and fluid catalytic cracking catalyst under ultra-fast heating,2022,2,"polyethylene terephthalate pet, supporting information, molecular weight, pyrolysis oil"
10.1021/acssuschemeng.2c00848,Bio-Based Flame-Retardant and Smoke-Suppressing Wood Plastic Composites Enabled by Phytic Acid Tyramine Salt,2022,2,"polyethylene terephthalate pet, supporting information, molecular weight, pyrolysis oil"
10.1038/s41467-023-39201-1,Mechanistic studies of a lipase unveil effect of pH on hydrolysis products of small PET modules,2023,2,"polyethylene terephthalate pet, supporting information, molecular weight, pyrolysis oil"
10.3184/003685007x228748,Plastic Recycling,2007,7,"marine debris, metric tons, human health, u s"
10.1039/c7nr03580b,Trash to treasure: converting plastic waste into a useful graphene foil,2017,2,"polyethylene terephthalate pet, supporting information, molecular weight, pyrolysis oil"
10.3390/recycling3030033,Sustainability Impact Assessment of Increased Plastic Recycling and Future Pathways of Plastic Waste Management in Sweden,2018,6,"supply chain, climate change, environmental impacts, value chain"
10.3390/recycling6020029,Incentives for Plastic Recycling: How to Engage Citizens in Active Collection. Empirical Evidence from Spain,2021,5,"sustainable development, environmental awareness, climate change, purchase intention"
10.1002/anie.202201785,Chemical Recycling of Poly(Cyclohexene Carbonate) Using a Di‐Mg<sup>II</sup> Catalyst,2022,2,"polyethylene terephthalate pet, supporting information, molecular weight, pyrolysis oil"
10.1021/acsami.8b11196,"Highly Efficient La<sub>2</sub>O<sub>3</sub>:Yb<sup>3+</sup>,Tm<sup>3+</sup> Single-Band NIR-to-NIR Upconverting Microcrystals for Anti-Counterfeiting Applications",2018,2,"polyethylene terephthalate pet, supporting information, molecular weight, pyrolysis oil"
10.3390/en15062114,"Recycling of Plastic Waste, with Particular Emphasis on Thermal Methods—Review",2022,6,"supply chain, climate change, environmental impacts, value chain"
10.3389/fmicb.2023.1178474,Discovery of plastic-degrading microbial strains isolated from the alpine and Arctic terrestrial plastisphere,2023,2,"polyethylene terephthalate pet, supporting information, molecular weight, pyrolysis oil"
10.1002/cite.202100102,Chemical Recycling of Mixed Plastic Wastes by Pyrolysis – Pilot Scale Investigations,2021,7,"marine debris, metric tons, human health, u s"
10.24840/2183-0606_007.004_0002,"Carbon Emission and Plastic Pollution: How Circular Economy, Blockchain, and Artificial Intelligence Support Energy Transition?",2020,5,"sustainable development, environmental awareness, climate change, purchase intention"
10.1016/j.jtte.2022.07.002,Review of recycling waste plastics in asphalt paving materials,2022,4,"compressive strength, mechanical properties, flexural strength, tensile strength"
10.3390/ma15010175,Performance Evaluation of Plastic Concrete Modified with E-Waste Plastic as a Partial Replacement of Coarse Aggregate,2021,4,"compressive strength, mechanical properties, flexural strength, tensile strength"
10.1016/j.spc.2020.12.015,"Exploring perceptions of environmental professionals, plastic processors, students and consumers of bio-based plastics: Informing the development of the sector",2020,7,"marine debris, metric tons, human health, u s"
10.1002/pc.23063,Synthesis and analysis of injection‐molded nanocomposites of recycled high‐density polyethylene incorporated with graphene nanoflakes,2014,3,"mechanical properties, tensile strength, polypropylene pp, injection molding"
10.1126/sciadv.abp8823,Circularity in mixed-plastic chemical recycling enabled by variable rates of polydiketoenamine hydrolysis,2022,2,"polyethylene terephthalate pet, supporting information, molecular weight, pyrolysis oil"
10.3390/su122310021,Technical Limits in Circularity for Plastic Packages,2020,7,"marine debris, metric tons, human health, u s"
10.3390/polym13162724,Risk Analysis on PMMA Recycling Economics,2021,6,"supply chain, climate change, environmental impacts, value chain"
10.1021/es503428j,"Identification of the Halogenated Compounds Resulting from the 1997 Plastimet Inc. Fire in Hamilton, Ontario, using Comprehensive Two-Dimensional Gas Chromatography and (Ultra)High Resolution Mass Spectrometry",2014,2,"polyethylene terephthalate pet, supporting information, molecular weight, pyrolysis oil"
10.1021/ac302109q,Atmospheric Solid Analysis Probe–Ion Mobility Mass Spectrometry of Polypropylene,2012,2,"polyethylene terephthalate pet, supporting information, molecular weight, pyrolysis oil"
10.3390/recycling9040059,Recent Developments in Technology for Sorting Plastic for Recycling: The Emergence of Artificial Intelligence and the Rise of the Robots,2024,7,"marine debris, metric tons, human health, u s"
10.1021/acssuschemeng.1c02420,<i>Is</i>PETase- and <i>Is</i>MHETase-Catalyzed Cascade Degradation Mechanism toward Polyethylene Terephthalate,2021,2,"polyethylene terephthalate pet, supporting information, molecular weight, pyrolysis oil"
10.3390/polym13234112,Mechanical Properties of Macro Polypropylene Fibre-Reinforced Concrete,2021,4,"compressive strength, mechanical properties, flexural strength, tensile strength"
10.1016/j.polymertesting.2021.107406,Prediction of polyethylene density from FTIR and Raman spectroscopy using multivariate data analysis,2021,3,"mechanical properties, tensile strength, polypropylene pp, injection molding"
10.1007/s43615-021-00056-7,A Call for a Socially Restorative Circular Economy: Waste Pickers in the Recycled Plastics Supply Chain,2021,5,"sustainable development, environmental awareness, climate change, purchase intention"
10.1179/2047058413y.0000000125,Polymers and volatiles: Using VOC analysis for the conservation of plastic and rubber objects,2014,7,"marine debris, metric tons, human health, u s"
10.1108/bij-11-2014-0103,An analysis of barriers for plastic recycling in the Indian plastic industry,2017,6,"supply chain, climate change, environmental impacts, value chain"
10.3390/en13082040,Pyro-Oil and Wax Recovery from Reclaimed Plastic Waste in a Continuous Auger Pyrolysis Reactor,2020,7,"marine debris, metric tons, human health, u s"
10.3844/ajassp.2006.1924.1928,Development of a Prototype Automated Sorting System for Plastic Recycling,2006,3,"mechanical properties, tensile strength, polypropylene pp, injection molding"
10.1080/02726351.2015.1043675,Tribocharging techniques for the electrostatic separation of granular plastics from waste electric and electronic equipment,2015,3,"mechanical properties, tensile strength, polypropylene pp, injection molding"
10.1002/masy.19910480127,Recycling of polymeric materials by pyrolysis,1991,3,"mechanical properties, tensile strength, polypropylene pp, injection molding"
10.1021/acsmacrolett.9b00481,Dual Organocatalysts Based on Ionic Mixtures of Acids and Bases: A Step Toward High Temperature Polymerizations,2019,2,"polyethylene terephthalate pet, supporting information, molecular weight, pyrolysis oil"
